{
  "slug": "northumbria-glasgow-edinburgh",
  "title": "Research Fellow",
  "organisation": "Northumbria University / Glasgow University / Edinburgh University",
  "location": "UK (multi-site)",
  "period": { "start": "2004-02", "end": "2006-07" },
  "type": "academic",
  "tags": ["learner modelling", "Java", "open learner model", "mathematics"]
}
