{
  "slug": "intrica",
  "title": "Web Developer",
  "organisation": "Intrica Ltd",
  "location": "Leeds, UK",
  "period": { "start": "2018-10", "end": "2018-12" },
  "type": "contract",
  "tags": ["PHP", "Angular", "OpenAPI", "REST"],
  "description": "Short-term contract role immediately following the transition from academia, working on a web application using Angular and an OpenAPI-specified REST backend in PHP. First professional engineering engagement in industry."
}
