{
  "slug": "glasgow-school-of-art",
  "title": "Research Fellow / Creative Technologist",
  "organisation": "Glasgow School of Art",
  "department": "Institute of Design Innovation / Digital Health Institute",
  "location": "Forres, Moray, Scotland",
  "period": {
    "start": "2014-07",
    "end": "2015-08"
  },
  "type": "academic",
  "tags": ["UX", "co-design", "PHP", "JavaScript", "digital health", "prototyping"],
  "description": "Research Fellow and Creative Technologist at the Digital Health Institute (DHI), scoping and executing design-led Experience Labs in Forres, under Don MacIntyre. Led pre-technology knowledge elicitation with healthcare, civic, and business participants across several co-design projects including Backpack (personal data stores for MS patients) and Digital Brokering (community actor-network mapping)."
}
